{
  "$schema": "https://kelvinccho.github.io/marathon-race/data/events.schema.json",
  "schemaVersion": 1,
  "checked": "2026-10-24",
  "publisher": "Marathon Race",
  "disclaimer": "Confirm every date on the official race site before you enter, pay, or book travel. Organisers change windows.",
  "milestoneTypes": [
    { "id": "ballot_open", "label": "Ballot opens", "color": "#0F6F6A" },
    { "id": "ballot_close", "label": "Ballot closes", "color": "#8A5300" },
    { "id": "result", "label": "Result", "color": "#5C4D8A" },
    { "id": "payment", "label": "Payment", "color": "#9D3D55" },
    { "id": "expo", "label": "Expo", "color": "#1E4F86" },
    { "id": "race", "label": "Race day", "color": "#A33B24" },
    { "id": "qualifier_open", "label": "Qualifier opens", "color": "#2D6A3E" },
    { "id": "qualifier_close", "label": "Qualifier closes", "color": "#1E4A2C" }
  ],
  "events": [
    {
      "id": "nyc-2026",
      "name": "TCS New York City Marathon",
      "shortName": "NYC",
      "edition": 2026,
      "series": "world_marathon_majors",
      "seriesStatus": "major",
      "order": 0,
      "city": "New York",
      "region": "New York",
      "country": "United States",
      "countryCode": "US",
      "timeZone": "America/New_York",
      "raceDate": "2026-11-01",
      "raceEndDate": null,
      "entryNoun": "drawing",
      "entryState": "decided",
      "hasPublicBallot": true,
      "officialUrl": "https://www.nyrr.org/tcsnycmarathon",
      "entryUrl": "https://www.nyrr.org/tcsnycmarathon",
      "fee": {
        "summary": "2026 entry was a few hundred dollars, higher for non-members. This file does not store a single fee because published figures differ by membership.",
        "confidence": "reported"
      },
      "odds": {
        "summary": "The 2026 general drawing is closed.",
        "acceptanceRate": null,
        "confidence": "reported"
      },
      "fieldNote": null,
      "summary": "Race day is Sunday 1 November 2026. Packet pickup is in person at the Jacob K. Javits Convention Center from Thursday 29 October through Saturday 31 October. There is no race-morning bib pickup and no proxy pickup.",
      "watchOut": "Bib pickup closes 30 minutes before the expo hall. Bring photo ID and your confirmation.",
      "checked": "2026-10-24",
      "sources": [
        { "label": "NYRR — TCS New York City Marathon", "url": "https://www.nyrr.org/tcsnycmarathon" }
      ],
      "milestones": [
        {
          "id": "ballot-open",
          "type": "ballot_open",
          "label": "Drawing opens",
          "at": "2026-02-04T00:00:00-05:00",
          "end": null,
          "endLabel": null,
          "date": "2026-02-04",
          "endDate": null,
          "precision": "day",
          "confidence": "reported",
          "primary": true,
          "note": "The 2026 drawing ran from 4 February. The hour is not stored.",
          "sourceUrl": "https://www.nyrr.org/tcsnycmarathon"
        },
        {
          "id": "ballot-close",
          "type": "ballot_close",
          "label": "Drawing closes",
          "at": "2026-02-25T00:00:00-05:00",
          "end": null,
          "endLabel": null,
          "date": "2026-02-25",
          "endDate": null,
          "precision": "day",
          "confidence": "reported",
          "primary": true,
          "note": "The 2026 drawing closed on 25 February.",
          "sourceUrl": "https://www.nyrr.org/tcsnycmarathon"
        },
        {
          "id": "result",
          "type": "result",
          "label": "Drawing results",
          "at": "2026-03-04T00:00:00-05:00",
          "end": null,
          "endLabel": null,
          "date": "2026-03-04",
          "endDate": null,
          "precision": "day",
          "confidence": "reported",
          "primary": true,
          "note": "Results were released on 4 March 2026.",
          "sourceUrl": "https://www.nyrr.org/tcsnycmarathon"
        },
        {
          "id": "payment",
          "type": "payment",
          "label": "Payment",
          "at": null,
          "end": null,
          "endLabel": null,
          "date": null,
          "endDate": null,
          "precision": "tbc",
          "confidence": "expected",
          "primary": true,
          "note": "Accepted runners paid when NYRR confirmed the place. A single public deadline is not stored for 2026.",
          "sourceUrl": null
        },
        {
          "id": "expo",
          "type": "expo",
          "label": "Expo",
          "at": "2026-10-29T10:00:00-04:00",
          "end": "2026-10-31T17:00:00-04:00",
          "endLabel": "Expo closes",
          "date": "2026-10-29",
          "endDate": "2026-10-31",
          "precision": "instant",
          "confidence": "reported",
          "primary": true,
          "note": "Javits Center, 11th Avenue between West 35th and 36th. Thursday 29 October 10:00–20:00 (bibs until 19:30), Friday 30 October 10:00–20:00 (bibs until 19:30), Saturday 31 October 09:00–17:00 (bibs until 16:30). No proxy pickup.",
          "sourceUrl": "https://www.nyrr.org/tcsnycmarathon"
        },
        {
          "id": "race",
          "type": "race",
          "label": "Race day",
          "at": "2026-11-01T00:00:00-04:00",
          "end": "2026-11-01T23:59:00-05:00",
          "endLabel": "Race day",
          "date": "2026-11-01",
          "endDate": "2026-11-01",
          "precision": "day",
          "confidence": "official",
          "primary": true,
          "note": "Sunday 1 November 2026. US clocks go back at 02:00 that morning, so midnight is still Eastern Daylight Time and the evening is Eastern Standard Time. The countdown uses the calendar day, not a wave start.",
          "sourceUrl": "https://www.nyrr.org/tcsnycmarathon"
        }
      ]
    },
    {
      "id": "tokyo-2027",
      "name": "Tokyo Marathon",
      "shortName": "Tokyo",
      "edition": 2027,
      "series": "world_marathon_majors",
      "seriesStatus": "major",
      "order": 1,
      "city": "Tokyo",
      "region": "Tokyo",
      "country": "Japan",
      "countryCode": "JP",
      "timeZone": "Asia/Tokyo",
      "raceDate": "2027-03-07",
      "raceEndDate": null,
      "entryNoun": "lottery",
      "entryState": "decided",
      "hasPublicBallot": true,
      "officialUrl": "https://www.marathon.tokyo/en/",
      "entryUrl": "https://www.marathon.tokyo/en/",
      "fee": {
        "summary": "About JPY 19,800 for runners in Japan and about USD 230 for international runners. Confirm the figure on the entry page; published amounts have differed by source.",
        "confidence": "reported"
      },
      "odds": {
        "summary": "Recent general lotteries have accepted roughly one in ten applicants. The 2027 rate was not published as a guarantee.",
        "acceptanceRate": null,
        "confidence": "reported"
      },
      "fieldNote": null,
      "summary": "The general lottery ran from 11:00 on 14 August to 17:00 on 28 August 2026, Japan time. Results went out on 18 September, with payment due by 30 September. There is no second general draw for 2027.",
      "watchOut": "A win is not a bib until the fee is paid. Miss the payment window and the place is released.",
      "checked": "2026-10-24",
      "sources": [
        { "label": "Tokyo Marathon 2027", "url": "https://www.marathon.tokyo/en/" }
      ],
      "milestones": [
        {
          "id": "ballot-open",
          "type": "ballot_open",
          "label": "Lottery opens",
          "at": "2026-08-14T11:00:00+09:00",
          "end": null,
          "endLabel": null,
          "date": "2026-08-14",
          "endDate": null,
          "precision": "instant",
          "confidence": "reported",
          "primary": true,
          "note": "General entry opened at 11:00 Japan time on Friday 14 August 2026.",
          "sourceUrl": "https://www.marathon.tokyo/en/"
        },
        {
          "id": "ballot-close",
          "type": "ballot_close",
          "label": "Lottery closes",
          "at": "2026-08-28T17:00:00+09:00",
          "end": null,
          "endLabel": null,
          "date": "2026-08-28",
          "endDate": null,
          "precision": "instant",
          "confidence": "reported",
          "primary": true,
          "note": "General entry closed at 17:00 Japan time on Friday 28 August 2026.",
          "sourceUrl": "https://www.marathon.tokyo/en/"
        },
        {
          "id": "result",
          "type": "result",
          "label": "Lottery results",
          "at": "2026-09-18T00:00:00+09:00",
          "end": null,
          "endLabel": null,
          "date": "2026-09-18",
          "endDate": null,
          "precision": "day",
          "confidence": "reported",
          "primary": true,
          "note": "General entry results were notified on 18 September 2026. The hour is not stored.",
          "sourceUrl": "https://www.marathon.tokyo/en/"
        },
        {
          "id": "payment",
          "type": "payment",
          "label": "Payment due",
          "at": "2026-09-30T23:59:00+09:00",
          "end": null,
          "endLabel": null,
          "date": "2026-09-30",
          "endDate": null,
          "precision": "instant",
          "confidence": "reported",
          "primary": true,
          "note": "Selected runners had to pay by 30 September 2026. Confirm the cutoff if you still have an unpaid place.",
          "sourceUrl": "https://www.marathon.tokyo/en/"
        },
        {
          "id": "expo",
          "type": "expo",
          "label": "Expo",
          "at": null,
          "end": null,
          "endLabel": null,
          "date": null,
          "endDate": null,
          "precision": "tbc",
          "confidence": "expected",
          "primary": true,
          "note": "Bib pickup is in person during race week. 2027 dates are not published in this file.",
          "sourceUrl": null
        },
        {
          "id": "race",